{
	"$schema": "../../node_modules/@cloudflare-asset-worker/cli/deploy.config.schema.json",
	"projectName": "Fullstack App Example",
	"assets": {
		"directory": "./public",
		"patterns": ["**/*"]
	},
	"serverCode": {
		"entrypoint": "index.js",
		"modulesDirectory": "./server",
		"compatibilityDate": "2025-11-09"
	},
	"run_worker_first": ["/api/*"],
	"config": {
		"html_handling": "auto-trailing-slash",
		"not_found_handling": "single-page-application"
	},
	"env": {
		"ENVIRONMENT": "production",
		"API_URL": "https://api.example.com",
		"APP_NAME": "Fullstack Example"
	}
}
